{
  "Id": "TacticalReadout",
  "Name": "Tactical Readout",
  "Author": "Ashla contributors",
  "Description": "Boss timers, phases and alerts from combat-log events, with BARAS boss data built in and optional text-to-speech.",
  "Version": "0.2.0",
  "ApiLevel": 1,
  "Tags": [
    "timers",
    "triggers",
    "alerts",
    "raids"
  ],
  "License": "AGPL-3.0-only",
  "Source": "https://github.com/YozoraCho/Holocron",
  "Download": "https://github.com/YozoraCho/Holocron/releases/download/TacticalReadout-v0.2.0/TacticalReadout-0.2.0.zip",
  "Sha256": "c4b6ef85086c76a28423d29f7c29378c0371d52b46736d5a081dfc47b89362a7",
  "Files": {
    "Fights/BARAS/flashpoints/a_traitor_among_the_chiss.toml": "67d70545d1949df14844cdac7272f53f3fe17bf4ae25bcb99b77895bf9f6f7d8",
    "Fights/BARAS/flashpoints/assault_on_tython.toml": "635c7324144c190a7052a8111307146070c51f51e7424ec9ff61de18f2d521c6",
    "Fights/BARAS/flashpoints/athiss.toml": "29f35b352e923edb465253ddbb463afd6dfc119ca8526d7dba38ba3dae635c5c",
    "Fights/BARAS/flashpoints/battle_of_ilum.toml": "433d4c458ae8eb9b059e8827f63c71ce093f99c9cd673ec55a5aadddb0ceacf6",
    "Fights/BARAS/flashpoints/battle_of_rishi.toml": "286d2f4c20cbe8ae062b7f1bf122a7d83034ec0183ea29a6247d6327349df805",
    "Fights/BARAS/flashpoints/black_talon.toml": "3f70fd298856fdc65b4d3ebd4ff29bc729bdc987febad85e2626c1b150b970dc",
    "Fights/BARAS/flashpoints/blood_hunt.toml": "9eb4b78e18281f64b43706c79171a779e22c4fb53f7c6f8ec4d36aa22b6130d2",
    "Fights/BARAS/flashpoints/boarding_party.toml": "06aa5f07c5006cb41ae573f55fff642e7928821a9e5fc5f8ac66b6488a80736d",
    "Fights/BARAS/flashpoints/cademimu.toml": "0593637b9e1f28d166e0333406c69d9b7ff2c9758760c76e9334f27931598750",
    "Fights/BARAS/flashpoints/colicoid_war_game.toml": "8456d61301d9bb632c7511affedcb5b6a4164c8e1e7ae337d033559c6d6b34b7",
    "Fights/BARAS/flashpoints/crisis_on_umbara.toml": "63c0ca1bc03c2b66b680c85525381876d7ce7763b89fcee74894dc675ee6d3e4",
    "Fights/BARAS/flashpoints/czerka_core.toml": "418ff0521a4d78bb67f12ade43036c5f47cf574b72f07809adf4227497724ed4",
    "Fights/BARAS/flashpoints/czerka_labs.toml": "fb0c5ecdce58edec48894d25ed4dec78b967ce46236f8f29a449150a1fe03dde",
    "Fights/BARAS/flashpoints/directive_seven.toml": "fc2ffaea13f4838d7a925b6e4b2f34fc20b76f7b847797d4051d6d4d41a0370a",
    "Fights/BARAS/flashpoints/esseles.toml": "f16ca899c3c9ca0c25e1dcda8813d809b825b09d107cf918fd112608913e1026",
    "Fights/BARAS/flashpoints/false_emperor.toml": "9c5bdbd470cdb437f278a82a85349234dc0d63c16d14222162cd3fa5fc9f6747",
    "Fights/BARAS/flashpoints/foundry.toml": "d1effa234b82bce60b11095ed430c27a0c718277ce482a46a8995cecb42ea381",
    "Fights/BARAS/flashpoints/hammer_station.toml": "4e9d9c65d3a0ce6ba096b0985f5e1c0377e94ca6ccd7d1aa149e1ae49129ba6a",
    "Fights/BARAS/flashpoints/kaon_under_siege.toml": "243818d0dd6d3cce52bee6bf45f5da211e8a19c55dd94a78d4cc8895b82355ef",
    "Fights/BARAS/flashpoints/korriban_incursion.toml": "d9879c8c0771315952015146c16c8fa64c13c2f07e0737cd75f8682fb0ce4559",
    "Fights/BARAS/flashpoints/kuat_drive_yards.toml": "8c4be3c9f030df7984b3c0abf6b460d81d705265e5f79962ec5e090c7645fd55",
    "Fights/BARAS/flashpoints/legacy_rakata.toml": "b9b3877e33fb3bf2eda0b4f5f10087fe4e289f1f8f9719701944d14c17aa276f",
    "Fights/BARAS/flashpoints/lost_island.toml": "6ed0e5e4685d2f5cef443bab100734d3ac0716de6a97f8883f11ed6b7f89df5a",
    "Fights/BARAS/flashpoints/maelstrom_prison.toml": "bc4511418d15722bafcd9e24cf09aabf1059716dbd7d3d2fc6a10f88b9f5eb2f",
    "Fights/BARAS/flashpoints/manaan.toml": "d44408c972df970b9f95be743eb2861d0feb1b8f57ebdac6d5fc753af92379fc",
    "Fights/BARAS/flashpoints/mandalorian_raiders.toml": "42eacb53e0d18b05f600ad01efb2bb386bc5ff875a2c5100cc8b29e9f05c342e",
    "Fights/BARAS/flashpoints/nathema.toml": "0f62d4732fd12b6d384e24142c68bfb802e94087bf38b4939273096e6426e40a",
    "Fights/BARAS/flashpoints/objective_meridian.toml": "a03f970b42fd59c3c2069bae7c147a43e44ff89f9d493753c519095293a5b091",
    "Fights/BARAS/flashpoints/red_reaper.toml": "9308e38a7f42ca318e07dd8a3a4aa1fe9bc341ffe3ee46d0815373b217eb751b",
    "Fights/BARAS/flashpoints/ruins_of_nul.toml": "84addefec9ea684819f3a6eee4f186fee67ba1ab53cd39c43b0d7002c5341f06",
    "Fights/BARAS/flashpoints/secrets_of_the_enclave.toml": "07faddd9a26cf0b4c4eef1f711ae90edc700ca297f8c1cb9a7e9cdaccfa1add5",
    "Fights/BARAS/flashpoints/shrine_of_silence.toml": "f31cf1a8c1ebb279fa4c1a477fbef457fffcfcad19a37f782ea8c78ea452637b",
    "Fights/BARAS/flashpoints/spirit_of_vengeance.toml": "b7f6fa6261055f5b0f577dfed1110e15a4a86355bda4127e223ec44d9a1f6347",
    "Fights/BARAS/flashpoints/taral_v.toml": "1b09f7dcc57fdd3bec4f2847ca84926fdfe383113569dba4bb4b56c8bf11ad88",
    "Fights/BARAS/LICENSE": "5fde62ef2ca1e6a2eacac1169757423953a99564b4cce054c5fee1f91cbb33ca",
    "Fights/BARAS/operations/children_of_nul.toml": "c281b43026baf06645b24b05584f6d11114084ef2acecd76f9c5ef2a96086ac7",
    "Fights/BARAS/operations/dxun.toml": "e1899f38dfead7d0a6d7bb834bd40023f6b869d002482a63d76e89a3197e235c",
    "Fights/BARAS/operations/eternity_vault.toml": "47da40e1fe0ab2d507e17b16d12df4f6b26a9be9dc2edd4d234cbfc75cbe2b61",
    "Fights/BARAS/operations/explosive_conflict.toml": "1b2e2f5bee6a7dbded2e5997b1b2a9140deb841480b581f67616ed5fc996ee14",
    "Fights/BARAS/operations/gods_from_the_machine.toml": "cac38c88c7ec03582c08e6140709d5cf9dde3d604c059535218f1108ab801860",
    "Fights/BARAS/operations/hive_of_the_mountain_queen.toml": "c1bbe649d7cb61f41aafa246bda83d95319d69b1a549ce3ea6367c1d5abb6817",
    "Fights/BARAS/operations/karaggas_palace.toml": "8a2153762ce754c9861013dc183c94ea591a695b6c68eb3f27d5066b9756115d",
    "Fights/BARAS/operations/monolith.toml": "e8a36717d1cfd597a744283b2a4c66fe33fcf86c580e238da1826ab35bddf0b8",
    "Fights/BARAS/operations/propagator_core.toml": "99353c1b5f753b6af204e1e70ce79740652bd2d1fa71b6c0e2930a1dbc4eace7",
    "Fights/BARAS/operations/r4_anomaly.toml": "825921c4baaa99b1bdc6f82511b77a89c7d19e8c9816e75261ca0807ddd43e16",
    "Fights/BARAS/operations/scum_and_villainy.toml": "06ee8b1a27b7180a41e16a8da2ee59e6335f6ad790cbc7ceab214317875fb123",
    "Fights/BARAS/operations/temple_of_sacrifice.toml": "40eb2e7095c86a4624a70129e683f08589f4df983f768fa5a4b9c8e25a363577",
    "Fights/BARAS/operations/terror_from_beyond.toml": "b4e81515a527efd0e1a36dda2b34d103a64fa37b631f969559642b291a9ceb75",
    "Fights/BARAS/operations/the_dread_fortress.toml": "82eacc42a1daffacd8b070df488cb35fa3a1d29f2c71f5b5748511c665251533",
    "Fights/BARAS/operations/the_dread_palace.toml": "e8225cc1a734846e45a4906047fe992923f940910ef659cd85a8f503c1ff70f5",
    "Fights/BARAS/operations/the_eyeless.toml": "e124783c30d980358d2ab2588eddd385165c663499cd6da705b4b6bd15fc8916",
    "Fights/BARAS/operations/the_ravagers.toml": "e53eb5ff4c487c83f116a1439276660b96c53cf09e532ae8f693fc81236bddad",
    "Fights/BARAS/operations/toborros_courtyard.toml": "a85dcdbc9c517154202b37fcbcabadcfdf896d204d46eb743994fa04b8f80ccc",
    "Fights/BARAS/operations/xenoanalyst.toml": "63ff026ea00a48d0e1dc7dfaeac81255f08ce9952f0d5244660b880bee98a2a7",
    "Fights/BARAS/other/orbital_core.toml": "7ec805a8d489f7b7443d8f2108881ab90e9389507fc4bc6d440993bff0ea1dd4",
    "Fights/BARAS/README.md": "8a4a8a4a46d4a586b6e9fddce00a257be52a19aacf874e9e2996a3c8337834ea",
    "runtimes/win/lib/net10.0/System.Speech.dll": "75861292d8d9f7354c6bb379615a5090e1957f53a5f9ae3c775e46ebd256957f",
    "System.Speech.dll": "3a085da963e10fe149bc6dce8eb4abfe5d1bc5221df4e1a5c9b40c3daddd76bf",
    "TacticalReadout.deps.json": "11586e17900d6e06a6dc8cdb09651e7e3595a5dd7aaaf784b3686e22c1e13d72",
    "TacticalReadout.dll": "e69ff694a17a6be1af7ae06bcc9e0d69dc7a6e8654ecf66f2ade1e894bb38ca1",
    "TacticalReadout.runtimeconfig.json": "2e1693f8326910b07be4292d78dceba9cb49952c500afab1860d09b4d5e54047",
    "THIRD-PARTY-NOTICES.txt": "4c5a6cdf6afe351faabf392191380c604c733884b19423aa39dea31a52cc457c",
    "Tomlyn.dll": "2366b14ae842bf9d4eadf206c8b20c7c2217ff75b5f4567999c5c7a9caae6dea"
  },
  "Changes": "First release. Boss timers, phases and alerts for 54 operations and flashpoints from BARAS, plus your own fight files and optional text-to-speech."
}
